songId,title,artist,genre,album,lyricist,composer,date,img,comment,like,lyric,plylstSeq
35618160,City Lights (Feat. Hash Swan),릴러말즈 (Leellamarz),랩/힙합,City Lights,릴러말즈 (Leellamarz),Hash Swan,20220910,https://cdnimg.melon.co.kr/cm2/album/images/110/51/149/11051149_20220908140430_500.jpg?5394ef4bcd8ab4ad332de30aebb7d2e0/melon/resize/282/quality/80/optimize,77,21232,"도망가 From the city lights
도시의 빛을 피해
불빛들을 피해
도망가 From the city lights
더 밟아 나는 빨리
너도 갈래 같이
우리 도망가자 시끄러운 얘기
머리 지끈거릴 일거리들
Baby Im on the way
넌 몸만 오면 돼 가자고 어디든
이제는 지쳤어
이 도시는 미쳤어
절벽으로 밀어 자꾸
또 어딘가로 쓸려 갈 뿐
Wait wait 더는 안돼
일이 좀 많아서 피곤한데
오늘은 나 먼저 들어갈 게
진짜 이게 마지막 담배
멀리 후후 불어 후후
얼굴 보자고 다음 주에
무슨 일이 있을지는 나도 모르지만
그러니까 하지 말아 줬으면 해 실망
쌓인 일들은 내 키만 해
택배는 와있데 집 앞에
오늘 하루는 큰일 났네
끝날까 하루 안에
못 깨어났나 아직도 꿈 안에서
여기저기 사고는 틈만 되면
일어나지 두통은 일상같애
남들은 내 성격이 불같대
아직도 나는 제일 어려워 쿨한 게
짐 싸 폰도 끄고 올라타
차에 몸을 올리고선 음악 소릴 키워줘
날 찾을 수 없게
누구도 들을 수 없게
미쳤다고 하겠지만
못 찾을 거랬지만
도망가 From the city lights
도시의 빛을 피해
불빛들을 피해
도망가 From the city lights
더 밟아 나는 빨리
너도 갈래 같이
우리 도망가자 시끄러운 얘기
머리 지끈거릴 일거리들
Baby Im on the way
넌 몸만 오면 돼 가자고 어디든
이제는 지쳤어
이 도시는 미쳤어
절벽으로 밀어 자꾸
또 어딘가로 쓸려 갈 뿐
피곤해 피곤해
네온색의 파도가 덮치려 해
난 거기 부표같이 떠 있어 매일
마지막 잔이 날 해치려 해
City’s like crayon thought
we on the sion
But blizzard’s coming
from our brainwash
shoulda told Napoleon
취해서 보는 모든 건
나의 화려한 새벽이면서
동시에 또 외로운 낮이기도
제정신 일리가 이 도시에서
난 여전히 누구든
믿지 않을 수 있다 믿으니
서랍 어딘가에 넣어둔
아스피린을 찾아
오늘따라 지랄맞은
내 마인드맵을 잘라
반복했던 그 반대로 뛰어
So I’m coming home
도시의 멍청한 내게 전하려
가르강튀아로 번지
만나 말 걸어도 I was overdose
도망가 From the city lights
도시의 빛을 피해
불빛들을 피해
도망가 From the city lights
더 밟아 나는 빨리
너도 갈래 같이
우리 도망가자 시끄러운 얘기
머리 지끈거릴 일거리들
Baby Im on the way
넌 몸만 오면 돼 가자고 어디든
이제는 지쳤어
이 도시는 미쳤어
절벽으로 밀어 자꾸
또 어딘가로 쓸려 갈 뿐",445557345 458920936
5815785,사이먼 도미닉,사이먼 도미닉,랩/힙합,￦ & ONLY,사이먼 도미닉,GRAY (그레이),20150821,https://cdnimg.melon.co.kr/cm/album/images/023/34/436/2334436_500.jpg/melon/resize/282/quality/80/optimize,216,117201,"Simon Simon Dominic
Simon D o m i n i c oh oh
Simon Simon Dominic
Simon D o m i n i c oh oh
Simon says
1998' 당시 내 고향은 
힙합 불모지
Ra D와 Keeproots 
두 사람은 나의 OG
난 Bad Boy 대신에 
교복에 flip-flop
쉬는 시간엔 축구보다 
힙합 CD와 beatbox
라이브 클럽이 
콜라텍으로 바뀌던 시기쯤에
무대를 잃었던 
내 라임들은 부지기수
지금은 찾을 수도 없는 
그 시절 내 demo tape
그때보다 순수한 걸 
이젠 못 내놓네
부대 똥다리 또 
부산역 광장에서
freestyle 하던 때가 
나의 첫 번째 primetime
가리온이 부산에 떴다 하면 
짝퉁 백포스 꺼내 
신고선 어디든 달려갔고
Master Plan 보면서 
부러웠던 서울
내 꿈은 기차로 
딱 네 시간 거리에 있었어도
부모님 믿음 없인 
힘이 없던 내 a k a 
어쨌건 음악은 
내 삶의 첫걸음을 
떼게 했네
모든 남자들은 S'up 
모든 여자들은 ass up
you can call me 
Simon D o m i n i c 
더 크게 불러줘 
say my name say my name
Simon Simon Dominic
Simon D o m i n i c oh oh
Simon Simon Dominic
Simon D o m i n i c oh oh
힙합이 밥도 안 맥여 준다고 
남 탓하던 놈들은 옆에 안 뒀지
내 성격 좀 tight했거든
away game에 더 강했던 
hometown hero
대구에서 나 같은 놈 
하나 만난 뒤로 
game changed
이센스와 난 갱상 
finest two 촌놈 styles
서울의 mc들을 먹어 치우는 꿈
2008 앨범 한 장 없었어도 
underground kingz
섭외 1순위에 
우릴 매번 올려놨지
믹스테잎은 다 sold out
아메바 계약 후엔
내가 번 돈만 본 다음 
몇몇은 배 아프대
오해 가득한 술자리에선 
talk dirty 2 em'
잃은 게 좀 많지만 
다 추억거리뿐인
20대가 남긴 건 
사라질 인기와 돈 따위
물론 지금의 내가 
있기까지의 도움닫기
밤낮 없던 압박감들 
다 잊지 못해도
기억할 건 내 이름과 이센스 
team forever
ever ever
모든 남자들은 S'up 
모든 여자들은 ass up
you can call me 
simon d o m i n i c 
더 크게 불러줘 
say my name say my name
Simon Simon Dominic
Simon D o m i n i c oh oh
Simon Simon Dominic
Simon D o m i n i c oh oh
always on my grind
여러 번의 테이크에 
이제 인트로 하나를 잘 끝냈네
차가운 새벽은 
몇 번이나 날 죽이고서
다음날 밤에 다시 뜨겁게 
부활시켜줬어
나의 제2막
책임감이 날 애타게 한 뒤에
내 야망은 쉽게 눈 안 떠 
top 100 따위엔
돈이 다가 아냐 
i just wanna rhyme with my homies
누릴 수 있을 때 
누리는 거야
난 오직 음악에 살 거야 
그게 내 성공의 좌표
one love 따윈 
개나 주고 
다들 눈에 힘 빡 줘
래퍼 vs 래퍼 
레이블 vs 레이블
메이저 vs 마이너 
그 모든 것들 vs 내 이름
Simon Simon Dominic
Simon D o m i n i c oh oh
Simon Simon Dominic
Simon D o m i n i c oh oh",
35922931,결혼 행진곡,김농밀,랩/힙합,결혼 행진곡,김농밀,Audiosfrom (오디오스프롬),20221213,https://cdnimg.melon.co.kr/cm2/album/images/111/21/953/11121953_20221213170008_500.jpg?3e6bf3a744f272fd06e6fecfe48fbaa8/melon/resize/282/quality/80/optimize,49,5418,"내 청춘을 이렇게 보내기엔
너무나 아까운 지금
그렇다고 아무나 만나기엔
맘 한 켠이 괜히 시려
기다리면 님이 올까요
슬픔에 젖은 밤에
난 눈물 훔칠 때 그대와 마주쳐
이런 이런
우리 전에 봤지 맞지
신사동 거기에 그렇지 맞지
아무 이유나 갖다 붙임
나 처음이야 이렇게까지
둘이서 가자 나만 아는 맛집
강남 홍대 이태원까지
어서 끼워 줘 My Wedding 반지
나 진짜로 처음이야 이렇게까진
난 그댈 만나기 전까지
혼자서 지금까지
외로이 지냈던 밤
오히려 조금 아쉬워요
벌써 난 결혼까지 생각해
원래는 아냐 이런 놈
정해놨어 우리 아들 딸내미 이름
그대와 만난 채로 백년해로
뭐가 됐든 너와 함께하면
전부 새로워 (이건 우리)
새하얀 그대 손 맞닿은 채로
지금 그대로 시동 걸어 장모님께로
너만 있어 주면 그 누구도 안 부러워
이건 우리 결혼 행진곡
구했어 신혼 방 혼수까지 다
결혼 행진곡 결혼 행진곡
잠깐 그대로 멈춰
이게 어디서 추파를 던져
내 피앙세를 건들면 다쳐
명절 인사도 안 돼 다 닥쳐
사랑에 Better than Rockstar
세레나데 도레미파솔
넌 사라비 난 네 무파사
그래 어떻게든 들어야겠어 네 맘에
무조건 달려가 어디든 간에
보고 싶으면 불러 늦은 밤에도
어차피 밤에 일어나서 괜찮애
난 그댈 만나기 전까지
혼자서 지금까지
외로이 지냈던 밤
오히려 조금 아쉬워요
벌써 난 결혼까지 생각해
원래는 아냐 이런 놈
정해놨어 우리 아들 딸내미 이름
그대와 만난 채로 백년해로
뭐가 됐든 너와 함께하면
전부 새로워 (이건 우리)
새하얀 그대 손 맞닿은 채로
지금 그대로 시동 걸어 장모님께로
너만 있어 주면 그 누구도 안 부러워
이건 우리 결혼 행진곡
구했어 신혼 방 혼수까지 다
결혼 행진곡 결혼 행진곡
안녕히 계세요 여러분
저는 이 세상의 모든 속세와
굴레를 벗어던지고
제 사랑을 향해 떠납니다
그럼 모두 행복하세요",446116273 448083759
33528907,역겹겠지만 (Remember me),B.I,랩/힙합,WATERFALL,B.I,B.I,20210601,https://cdnimg.melon.co.kr/cm2/album/images/106/17/588/10617588_20210601115300_500.jpg?d01da422eadf4efcb0503aa029e9442c/melon/resize/282/quality/80/optimize,197,55238,"역겹겠지만 날 잊지는 마
그래도 사랑했던 사이니까
너의 기억 속에서조차
사라지게 되면
난 이 세상에 없을 거야
역겹겠지만 날 잊지는 마
한때는 애틋했던 우리니까
지독한 사람으로 너의
과거에 남아서
난 부서지듯 아플 거야
불행했니 나를 만난 걸
땅을 치고 후회했니
내 욕을 하면서 도로를 주행했니
홧김에 이것저것 충동구매했니
야 내가 그렇게 밉냐
잘 생각해 봐
행복한 순간들이 더 많았잖아
너는 어떨지 모르겠지만
나한텐 네가 온 세상이고
중심이었단 말이야
역겹겠지만 날 잊지는 마
그래도 사랑했던 사이니까
너의 기억 속에서조차
사라지게 되면
난 이 세상에 없을 거야
역겹겠지만 날 잊지는 마
한때는 애틋했던 우리니까
지독한 사람으로 너의
과거에 남아서
난 부서지듯 아플 거야
쨍그랑 내 맘이 깨지는 소리
완벽한 혼자가 되어 고독함 속에 고립
It’s like brrrrrrrr
1월보다 추웠던 너의 눈빛에
심장이 떨리는 소리
청천벽력이었지
너의 그 고운 입에서
그런 심한 말이 나올 때
망치로 맞은 듯했어 뒤통수
역겹겠지만 날 잊지는 마
그래도 사랑했던 사이니까
너의 기억 속에서조차
사라지게 되면
난 이 세상에 없을 거야
역겹겠지만 날 잊지는 마
한때는 애틋했던 우리니까
지독한 사람으로 너의
과거에 남아서
난 부서지듯 아플 거야
너 아니면 누가 기억하겠어
너의 옆에서 행복했던 나를
역겹겠지만 날 잊지는 마
그래도 사랑했던 사이니까
너의 기억 속에서조차
사라지게 되면
난 이 세상에 없을 거야
너 아니면 누가 기억하겠어
너의 옆에서 행복했던 나를
역겹겠지만 날 잊지는 마",445557345 458920936
32091615,호랑이소굴 (Feat. Jvcki Wai),기리보이,랩/힙합,호랑이소굴,기리보이,Jvcki Wai,20191013,https://cdnimg.melon.co.kr/cm2/album/images/103/37/675/10337675_500.jpg?14f7627c4bba45d6bcdcac5a4093e4b8/melon/resize/282/quality/80/optimize,599,73484,"Uh take it to the next lev
Uh 개처럼 냄샐
맡어 나의 뒤엔 gang gang
Playing game
튀지 않는 나의 취향은 basic
몇 번의 위기 위를 넘어 다녀
너무 빠른 세상에서 걸어 다녀
계속 벌어 나는 계속 벌어
몇 번 넘어져도 나의 커리어는 떳떳
또 멀어져 가네 나의 고향 서울
멍청해지지 돈을 벌면
친구들은 하나둘씩 떠나가
문제였을까 싶어 나의 변화가
나는 멋진 놈이고 싶어
이긴 만큼 깊어져
나는 쿨하게 지고 싶어
멋있게 지고 싶어
좋은 날은 오니까
오늘 하룰 버텨 나쁜 일이라도
나는 가볼래
내가 알던 곳부터 낯선 곳도
내가 바보래도
나는 가볼래 들어가 볼게
나는 호랑이 소굴로 들어가
나는 호랑이 소굴로 들어가
나는 호랑이 소굴로 들어가
나는 호랑이 소굴로 들어가
그냥 살다 보니 어느새 난 여기
사실 별거 없지 잘은 해 밥벌이
흩날리는 잿더미 모두 불태웠지
나 아직은 멀었지만
사라져가 내 꿈이
이 기분은 마치 쓰러질 도미노
같이 위태한 친구들과 날 위로
TV 안 나가고 별이 된 기분
물어봐 뭐해 알맹이는 같애
전부 태워볼래
기리보이처럼 flexin’ hard all day
전부 가져볼래
전부 가볼게 전부 다 볼게
전부 가본 뒤에
날 조용히 묻어줘 서울 아닌 곳에
그때라도 맘 편히 쉴 수 있게
또 한 번의 계절이 끝나가
새로운 이름들 날 지나가
기억하려 하지 좋은 순간만
뭐가 어찌 되든 we gon be alright
이 게임의 룰은 잘 몰라 난
그래도 다음 단계를 올라가
많은 걸 바라진 않아 난
단지 되고 싶어 사람 같은 사람
나는 호랑이 소굴로 들어가
나는 호랑이 소굴로 들어가
나는 호랑이 소굴로 들어가
나는 호랑이 소굴로 들어가
나는 호랑이 소굴로
나는 호랑이 소굴로
나는 호랑이 소굴로
나는 호랑이 소굴로 들어가",445557345 458920936
31096073,빈집 (Prod. By dnss) (Feat. THAMA),기리보이,랩/힙합,3곡,기리보이,THAMA,20180526,https://cdnimg.melon.co.kr/cm/album/images/101/70/534/10170534_500.jpg?27d4ae9af6a782c221fb1a9d11ad0b16/melon/resize/282/quality/80/optimize,428,84789,"그녀의 예쁨
그녀의 향기 그녀의 말투
그녀의 발 그녀의 팔
그녀의 옷 그녀의 손
그녀의 목 그 위에 목걸이
그녀가 담긴 그녀의 욕조 위
떠있는 거품 영어론 버블
그녀의 거품 그녀는 거품
쉽게도 사라지지 yeah
넘 쉽게 떨어진 잎 위에
뜨거운 물을 부어 차를 달이려 해
그 시간은 지루하지
난 참을성이 없어 아쉽게도
난 참을성이 없어 아쉽게도
내 성격 이대로 다 바뀌게 둬
내 성격 이대로 다 바뀌게 둬
아쉬운 건 아쉬운 대로
다 의미가 있지
아쉬울 걸 아쉬워하면
넌 딴 데 가 있지
그게 집착이라는 치명적 실수
맘 정리하고 어깨를 피고
크게 숨 쉬고 추파를 던져
맞춰 죽이는 사랑은 피구
너를 느끼고 너를 느껴
너를 느끼고 너를 느껴
어깰 죽이고 허릴 굽혀
어깰 좁히면 널 안을 수 있어
널 알 수 있어
널 살 수 있어
돈 없이도 난
널 살 수 있어
널 살 수 있어
널 살 수 있어
널 살 수 있어
넌 살 수 있어
Please don’t say
that you ain’t lying
알 수 있어 난 Oh
Please don’t watch me burn alive
Alive
잡생각이 섞여서
생각하는 게 더 깊어
I've been tryna get it straight
but it's fucked up
I've been lovin' you
since when I woke up
Oh huh
내게 말해줘 no no no no baby
I've been loving you oh you oh you
Face it up and promise
that you call
Girl love won't you please
아 치명적 실수
죄는 없지만 죄인이 돼
뻔한 일상들은 뻔하게 흘러가
사랑은 지금이 메인이벤트
난 화나서 우드드 떨리고
넌 무서워 오드드 떨지 넌
우리의 추억이 멋지던 후지던
예쁘게 변하지 가루 또 먼지로
니가 얼굴에 바르던 거 말야
우리가 털어 버리던 거 말야
너는 날 범죄자 보는 거 마냥
역겨워 하지 너의 그 오만한
표정에 나는 미치겠어 돌아버려
오락가락해
너 한번 안을 때 내가 두 번 안은 게
왜 죄가 돼
그녀의 예쁨
그녀의 향기 그녀의 말투
그녀의 발 그녀의 팔
그녀의 옷 그녀의 손
그녀의 목 그 위에 목걸이
그녀가 담긴 그녀의 욕조 위
떠있는 거품 영어론 버블
그녀의 거품 그녀는 거품
쉽게도 사라지지 yeah
쉽게도 사라지지 yeah
쉽게도 사라지지 yeah
쉽게도 사라지지 yeah
넌 먼지보다 작아져 이미
여긴 그 무엇보다 밝았던 빈집
밝았던 빈집
밝았던 빈집",418743549 445557345
2291954,트로트,에픽하이 (EPIK HIGH),랩/힙합,[e],DJ 투컷,미쓰라 진,20090916,https://cdnimg.melon.co.kr/cm/album/images/006/65/451/665451_500.jpg/melon/resize/282/quality/80/optimize,80,29247,"하아 힘든 세상
어디 하나 기댈 데도 없는
이 세상
너뿐이다 트로트
아무리 각 잡아봐도 똑바로 봐도
술취하면 똑같아 뱃속에 파도
일렁일 때마다 되려 술잔을 찾고
팔다리는 나풀대 마이크를 잡고
딴따라따따따
트롯가락에 맞춰서
움직여 네 박자
땡뻘같은 하루에 유일한 동반자
술깨면 떠나 사랑은 나비인가봐
누군 슬플 때 막춤을 춰
난 헌 걸레처럼
이 썩어빠진 아픔을 쥐어 짜
차차차 노래 쥐어 짜짜짜
반짝이 옷을 입은 것처럼 랄랄라
음정은 내 생활처럼 불안해
소주잔에 비친 내 모습
처량하고 불쌍해
누가 내 맘을 알아줄까
크게 불러 술안에 젖어가는
인생이여
갈대처럼 휘고
잡초처럼 밟힌 내 인생살이
술 한 잔에 울고
노래가락속에 웃는 내 인생아
나의 트로트
힙합 댄스 락
발라드도 좋지만 슬플 땐 What
힙합 댄스 락
발라드도 좋지만 슬플 땐 What
힙합 댄스 락
발라드도 좋지만 슬플 땐 What
힙합 댄스 락
발라드도 좋지만 슬플 땐
부산에선 여자가 심장을 찢고
난 떠났다 걸었다 대구 대전찍고
끝내 서울시
밤이면 밤마다 술을 퍼붓지
네온밤도 어둡지
갈 곳이 없어 난 힘이 없어
홀로 남은 개리형처럼 길이 없어
여기 멈춰 한곡을 뽑아
밤이면 밤마다 마이크의 목을 졸라
오늘의 무대는 집앞 포장마차
숟가락 젓가락 잔이 만든 박자
슬플 때 요즘 노래보다 낫다
구수한 가사 난 이 맛으로 산다
마치 어머니의 된장국처럼
잊혀질 만하면 생각 중
지나간 옛 애인처럼 떠올라
한바탕 불러대면 술이 떠올라
갈대처럼 휘고
잡초처럼 밟힌 내 인생살이
술 한잔에 울고
노래가락속에 웃는 내 인생아
나의 트로트
힙합 댄스 락
발라드도 좋지만 슬플 땐 What
힙합 댄스 락
발라드도 좋지만 슬플 땐 What
힙합 댄스 락
발라드도 좋지만 슬플 땐 What
힙합 댄스 락
발라드도 좋지만 슬플 땐
트로트

갈대처럼 휘고
잡초처럼 밟힌 내 인생살이
태산처럼 쌓여
모래처럼 흩어진 나의 인생아
갈 데없이 뛰고
정처없이 떠도는 하루살이
술 한잔에 울고
노래가락속에 웃는 내 인생아
나의 트로트
힙합 댄스 락
발라드도 좋지만 슬플 땐 What
힙합 댄스 락
발라드도 좋지만 슬플 땐 What
힙합 댄스 락
발라드도 좋지만 슬플 땐 What
힙합 댄스 락
발라드도 좋지만 슬플 땐
트로트",
35640852,윤슬 (Gold Dust),NCT 127,발라드 랩/힙합,질주 (2 Baddies) - The 4th Album,이채영 (JamFactory),"Maureen ""Mozella"" McDonald",20220916,https://cdnimg.melon.co.kr/cm2/album/images/110/56/832/11056832_20220915150210_500.jpg?2ba2c8a3e870df097060f0bbac4257b2/melon/resize/282/quality/80/optimize,493,41770,"잘 자 내 달빛
이리 와서 안겨 깊숙이
밤이 수 놓인
잔물결 위로 누워
아마 너는 모르지
얼마나 네 빛이 예쁜지
금세 잔뜩 닿아 반짝이잖니
금색 길을 내어 나를 빛내지
널 만나기 전엔 그저 어두웠지
칠흑 같은 바다 밑을 본 적 있니
일렁이는 얼굴 표정 없는 매일
괜히 흘러갈 뿐 기대 없던 내일
그런 어느 날 내 위로 쏟아지던 은하수
안녕하고선 빤히 날 바라보는 눈망울
그제야 눈치챘어 손에 물든 빛
별이 뜬 게 아냐 이건 너야
짙은 밤 내게 와서 너를 새기던 길
금빛이 된 바다 달이 떴네
시간이 멈춘 것 같았던 그 즈음
단번에 널 떠올리곤
이게 사랑일까 해
잘 자 내 달빛
이리 와서 안겨 깊숙이
밤이 수 놓인
잔물결 위로 누워
아마 너는 모르지
얼마나 네 빛이 예쁜지
금세 잔뜩 닿아 반짝이잖니
금색 길을 내어 나를 빛내지
물기 어린 내음 고갤 들게 해
어김없이 생긋 웃어주는 너 nah nah
왜일까 네게서 바다 향이
어젯밤 나에게 묻은 건지
코끝을 맴도네
Give it to me give it to me
오늘도 다시 올까 소란한 그 빛
벌써 스러져가 아득한데
감은 눈 뜨면 순간 너와 하늘이길
금빛 길을 따라 네게 갈게 (Yeah)
잘 자 내 달빛
이리 와서 안겨 깊숙이
밤이 수 놓인
잔물결 위로 누워
아마 너는 모르지
얼마나 네 빛이 예쁜지
금세 잔뜩 닿아 반짝이잖니
금색 길을 내어 나를 빛내지
무한하게 반짝여 넌 Like magic
그 환함에 전부 다 잊어 Bad things
그런 너를 좋아해 이미 알지
꿈에서도 아른거리는 달빛
Oh ah oh ah 어디 한번 물어봐
파도 위에 손 대봐
고요하던 물결이 요동치는 것을 봐
오직 널 향해 흘러
그 중력의 힘에 내 바다가 다 말라도
잘 자 내 달빛
이리 와서 안겨
깊숙이 밤이 수 놓인
잔물결 위로 누워
아마 이제 알겠지
얼마나 네 빛이 예쁜지
금세 잔뜩 닿아 반짝이잖니
금색 길을 내어 나를 빛내지
Gold Dust up my sea
금색 가룰 뿌려 찬란히
밤이 수 놓인 잔물결 위에 뿌려
아마 이제 알겠지
얼마나 네 빛이 예쁜지
금세 잔뜩 닿아 반짝이잖니
금색 길을 내어 나를 빛내지",502383664 488743634
2566835,가슴에 살아 (Feat. 나르샤 Of Brown Eyed Girls),언터쳐블,랩/힙합,Untouchable Mini Album 2nd,디액션 (D.Action),슬리피,20100204,https://cdnimg.melon.co.kr/cm/album/images/007/90/957/790957_500.jpg/melon/resize/282/quality/80/optimize,61,29809,"Un Un Untouchable
come in at to worth game
Please come back to me
Please come back to me
Please come back to me Girl
I can't breath I can't smile
everyday so because of you
I can't sleep I can't live
everyday so because of you
Girl 아직 너를 향한 내 맘은
숨이 가빠지게 뜨거워
허나 나를 향한 네 맘은
숨이 멎어지게 차가워
난 너의 사랑에 메말라
건조해져 버린 내 맘에
유일한 수분은 눈물 지쳐가며 흘리죠
햇살 같은 미소에 벗어나기 힘들고
이별은 예고 없이
아픔을 퍼부은 소나기
아직 뜨거운 내 가슴엔
넌 살아 숨 쉬고 있어
널 향해 내 심장은
밤새도록 계속 뛰고 있어
그대 때문에 숨을 쉴 수 있어요
그대 때문에 웃을 수가 있어요
참 이상하게 웃어도 눈물이 흘러요
그대는 아직 내 가슴에 살아요
그대 가슴엔 내가 있나요
나 사는 동안
나 그대를 잊지 못해요
난 너 때문에 숨쉬고
난 너 때문에 웃는 사람
난 너 때문에 숨쉬고
난 너 때문에 웃는 사람
난 너 때문에 아프고
난 너 때문에 웃는 사람
난 너 때문에 아프고
난 너 때문에 우는 사람
I can't breath I can't smile
everyday so because of you
I can't sleep I can't live
everyday so because of you
차가운 겨울 바람처럼
시리고 아픈 이별들은
돌고 도는 계절처럼
또 다시 내게로 밀려왔어
따스한 봄날처럼 아름다웠었던 기억
무덥던 지난날에 여름처럼
뜨겁던 우리는 없어
힘없이 떨어지는 낙엽처럼
사랑은 죽어갔고
오지 않을 것 같던 겨울은
결국 내게로 찾아왔어
사람은 차가운 사랑을 할 운명인걸
사랑을 나는 못 믿어 이젠
그대 때문에 숨을 쉴 수 있어요
그대 때문에 웃을 수가 있어요
참 이상하게 웃어도 눈물이 흘러요
그대는 아직 내 가슴에 살아요
그대 가슴엔 내가 있나요
나 사는 동안
나 그대를 잊지 못해요
난 너 때문에 숨쉬고
난 너 때문에 웃는 사람
난 너 때문에 숨쉬고
난 너 때문에 웃는 사람
난 너 때문에 아프고
난 너 때문에 우는 사람
난 너 때문에 아프고
난 너 때문에 우는 사람
내가 잘못한 게 있으면
용서해줘 배로 갚을게
다시 만날 수만 있다면
어떤 일이든 다 할텐데
아직도 그댈 잊을 수가 없어요
그대 흔적은 지워지질 않아요
참 꿈만 같던 우리의 소중한 추억만
아직도 그댈 기다리고 있어요
그대는 지금 어디 있나요
참 이상하죠
웃어도 눈물만 흘러요
Please come back to me
Please come back to me
Please come back to me Girl
Please come back to me
Please come back to me
Please come back to me Girl",
