songId,title,artist,genre,album,lyricist,composer,date,img,comment,like,lyric,plylstSeq
3611633,Ma Boy 2 (Feat. 효린),일렉트로보이즈,랩/힙합,Rebirth,마부스 (Maboos),용감한 형제,20111117,https://cdnimg.melon.co.kr/cm/album/images/020/34/566/2034566_500.jpg/melon/resize/282/quality/80/optimize,89,21770,"Ma Boy 2 (Feat. 효린)

You know this is for you ma 
Can't stop lovin' you ma 
마주보고 앉아서 서로 웃고 
온 동네를 누벼 서로 손 잡고 
너의 품에 안겨 눈 감고 
Ooh think I'm in luv wit you 
Ma girl Ma girl Ma girl Ma girl 
누가 뭐래도 넌 나의 girl 
Ma girl Ma girl Ma girl 
너를 사랑해 
Ma boy Ma boy Ma boy Ma boy 
모두 뭐래도 넌 나의 boy 
Ma boy Ma boy Ma boy 
나도 사랑해 
나는 항상 너를 찾아 
넌 내 실시간 1위 
내 온 관심은 you 
최면에 걸린듯이 
수리수리마수리 
하늘에서 내려오는 
진정한 beauty 
Ma 빛나는 ruby 
Eeenie meenie mannie mo 
아무리 봐도 오직 하나 
내겐 너 밖에 없어 
너와 난 현대판 
Romeo와 Juliet 
Fiona와 Shrek 니 사랑을 줄래 
I wanna see you girl 
Gimme a holla 
내가 필요할 땐 언제나 말해 
이렇게 너의 곁에 함께해 
너와 같이  
I wanna love you girl 
Gimme a holla 
너무 힘이 들땐 언제나 기대 
넌 내가 필요할 때 
언제든지 전화해 
Ma girl Ma girl Ma girl Ma girl 
누가 뭐래도 넌 나의 girl 
Ma girl Ma girl Ma girl 
너를 사랑해 
Ma boy Ma boy Ma boy Ma boy 
모두 뭐래도 넌 나의 boy 
Ma boy Ma boy Ma boy 
나도 사랑해 
나 원래 닭살돋는 짓은 잘 못해 
다른 남자들처럼 상냥하지도 못해 
알고보면 이게 내 매력인 걸 
예전부터 우리집의 내력인 걸 
세상에서 너를 제일 사랑하는 사람 
그 사람될께 Baby girl 평생 나랑 
함께 있어줘 
We gon' stick together forever 
변하지 않는 Diamond처럼 
I wanna see you girl 
Gimme a holla 
내가 필요할 땐 언제나 말해 
이렇게 너의 곁에 함께해 
너와 같이  
I wanna love you girl 
Gimme a holla 
너무 힘이 들땐 언제나 기대 
넌 내가 필요할 때 
언제든지 전화해 
Ma girl Ma girl Ma girl Ma girl 
누가 뭐래도 넌 나의 girl 
Ma girl Ma girl Ma girl 
너를 사랑해 
Ma boy Ma boy Ma boy Ma boy 
모두 뭐래도 넌 나의 boy 
Ma boy Ma boy Ma boy 
나도 사랑해 
잠시 떨어져있어도 
나는 니 숨결을 느껴 
매일 너만 보고파 
내 사랑 노랠 들어줘 
Baby fly wit me 
내 맘은 항상 너와 있어 
baby ride wit me 
우리 사랑은 변함없어 
너는 내 인생의 주인공 
정말 많이 사랑하나봐 
Ma girl Ma girl Ma girl Ma girl
누가 뭐래도 넌 나의 girl
Ma girl Ma girl Ma girl
널 사랑해
Ma boy Ma boy Ma boy Ma boy
모두 뭐래도 넌 나의 boy
Ma boy Ma boy Ma boy
나도 사랑해",
36455959,MAYBE I'M KCRAZY,식케이 (Sik-K),랩/힙합,ALBUM ON THE WAY!,식케이 (Sik-K),김하온 (HAON),20230518,https://cdnimg.melon.co.kr/cm2/album/images/112/46/453/11246453_20230517142955_500.jpg?0ceb644dacf5c11cc2f0fe54cb6bf8fb/melon/resize/282/quality/80/optimize,13,632,"Maybe I’m kcrazy maybe I’m stupid
Maybe I’m dumb son
Maybe I’m crazy maybe I’m bullsh*t 
Maybe I’m f***ed up 
Maybe I’m kcrazy maybe I’m stupid
Maybe I’m dumb son
Maybe I’m crazy maybe I’m bullsh*t 
Maybe I’m f***ed up 
Maybe I’m kcrazy maybe I’m stupid
Maybe I’m dumb son
Maybe I’m crazy maybe I’m bullsh*t 
Maybe I’m f***ed up 
Maybe I’m kcrazy maybe I’m stupid
Maybe I’m dumb son
Maybe I’m crazy maybe I’m bullsh*t 
Maybe I’m f***ed up 
두다리 뜬 날이 Couple days ago
난 파이리 Already feelin’ deja vu
나무위키에 나와 있지도 않아 이건
기억해 내 할 일 Get money
and get more get busy then
미끄럼틀 삐딱한 태도로 시끄럽든 말든
Yeah really don’t care no more
아직 쏜 적도 없어서 내 캐논볼
질문 있음 찾아와 강남대로로
초토화 it’s on that 빠케모노
내 새 차에는 절대로 못 태워줘
Snitch a** boy 
You already know
복수는 신의 것이지만
얼굴은 다 외워둬
A to Z who don’t wanna see me win
몇몇은 RPG they pay to win
I’m paid and win
Maybe I’m kcrazy maybe I’m stupid
Maybe I’m dumb son
Maybe I’m crazy maybe I’m bullsh*t 
Maybe I’m f***ed up 
Maybe I’m kcrazy maybe I’m stupid
Maybe I’m dumb son
Maybe I’m crazy maybe I’m bullsh*t 
Maybe I’m f***ed up 
Maybe I’m kcrazy maybe I’m stupid
Maybe I’m dumb son
Maybe I’m crazy maybe I’m bullsh*t 
Maybe I’m f***ed up 
Maybe I’m kcrazy maybe I’m stupid
Maybe I’m dumb son
Maybe I’m crazy maybe I’m bullsh*t 
Maybe I’m f***ed up 
Maybe I’m kcrazy maybe
I’m different yuh
Turn on the A/C,
hit’em up heat’em up yuh yuh
난 어른이지만 넌 아직 Children yuh yuh
나가라 잼민아 딱 나다 싶으면
Antisocial 너희들 유행이지
약 없이 우울해 죽겠는 척
봐주지 말라고 나 또한 봐줄 맘 없어
Know you better run
내 폰에 저장이 돼 있는
네 이름 부재중전화
통화 시그널에 백날 씨불여
헛짓거리 헛짓거리 몽땅 싸잡아
손가락질할래
에에에 에에에 손가락질할래
에게게 에게게 너희들 포부의 Scale
아마 안돼 나랑 경쟁
Wait wait
Shot caller, block shutter
명함 가져와 다 접어
I’m awesome
Maybe I’m kcrazy maybe I’m stupid
Maybe I’m dumb son
Maybe I’m crazy maybe I’m bullsh*t 
Maybe I’m f***ed up 
Maybe I’m kcrazy maybe I’m stupid
Maybe I’m dumb son
Maybe I’m crazy maybe I’m bullsh*t 
Maybe I’m f***ed up 
Maybe I’m kcrazy maybe I’m stupid
Maybe I’m dumb son
Maybe I’m crazy maybe I’m bullsh*t 
Maybe I’m f***ed up 
Maybe I’m kcrazy maybe I’m stupid
Maybe I’m dumb son
Maybe I’m crazy maybe I’m bullsh*t 
Maybe I’m f***ed up",443147074 458920936
7870705,리듬 타 (RHYTHM TA),iKON,랩/힙합,WELCOME BACK,B.I,BOBBY,20151116,https://cdnimg.melon.co.kr/cm/album/images/026/40/151/2640151_500.jpg/melon/resize/282/quality/80/optimize,140,65872,"We gon get it pop it
we gon we gon get it pop it
이건 그냥 노래니깐 리듬 타
Bounce 리듬 타 Bounce 리듬 타
Bounce 리듬 타
이건 그냥 노래니깐 리듬 타
뭐해 어서 고갤 끄덕이지 않고
가슴과 허리를 꿀렁이지 않고
우린 가리는 거 없어
예를 들면 때와 장소
멋있는 척 안해
나쁜 예는 요즘 아이돌
즐기는데 무슨 타당한 이유를 원해
이건 그냥 리듬 타기 좋은 흔한 노래
굳이 제목을 정하자면 칭찬
이 노래를 틀면
고래도 춤추게 하니까
yeah come and get it
모여 남녀노소
음악은 흐르지 방방곡곡
콧노래를 불러 ladi dadi
오늘밤은 ready to die yeah
die yeah
시간은 금 보기를 돌 같이 하라
비싼 척 하지마 놀고 싶은 거 알아
woo 콧노래를 불러 ladi dadi
다같이 움직여 body
Bounce 리듬 타 Bounce 리듬 타
Bounce 리듬 타
이건 그냥 노래니깐 리듬 타
We gon get it pop it
we gon we gon get it pop it
We gon get it pop it
we gon we gon get it pop it
We gon get it pop it
we gon we gon get it pop it
이건 그냥 노래니깐 리듬 타
뭐해 어서 고갤 끄덕이지 않고
어 밤이면 밤마다
오는 날이 아니잖소
오늘을 놓쳐서 후회한다면
후회한 시간을 후회할 거잖아
후회하기 싫음 후회할 일들을
후회하기 전에 후회 말아
Oh yeah right 리듬 타
Come on 방방 뛰어
나와 함께 리듬 타
UCC에 올려봐 꿀렁거리는 니 모습
여덟 마디 춤추기 좋게
여름 방학 계획표처럼 의미는 없음
Yeah come and get it 모여 남녀노소
음악은 흐르지 방방곡곡
콧노래를 불러 ladi dadi
오늘밤은 ready to die yeah
die yeah
시간은 금 보기를 돌 같이 하라
비싼 척 하지마 놀고 싶은 거 알아
woo 콧노래를 불러 ladi dadi
다같이 움직여 body
Bounce 리듬 타 Bounce 리듬 타
Bounce 리듬 타
이건 그냥 노래니깐 리듬 타
We gon get it pop it
we gon we gon get it pop it
We gon get it pop it
we gon we gon get it pop it
We gon get it pop it
we gon we gon get it pop it
이건 그냥 노래니깐 리듬 타
모두 고개를 끄덕여
팔짱 끼고 껄렁 거려
다같이 흔들흔들 흔들흔들 해
우린 좀 건들건들 건들건들 해
볼륨을 더 높이고
이 리듬에 몸을 맡겨
다 같이 흔들흔들 흔들흔들 해
우린 좀 건들건들 건들건들 해
리듬 타
Da na na na na na na
Da na na na na na na
Da na na na na na na
이건 그냥 노래니깐 리듬 타
We gon get it pop it
we gon we gon get it pop it
We gon get it pop it
we gon we gon get it pop it
We gon get it pop it
we gon we gon get it pop it
이건 그냥 노래니깐 리듬 타",
36321831,Vroong,릴러말즈 (Leellamarz),랩/힙합,Vroong,릴러말즈 (Leellamarz),NSW yoon,20230329,https://cdnimg.melon.co.kr/cm2/album/images/112/12/186/11212186_20230328141857_500.jpg?453cafa117dc549901e693e034b46a45/melon/resize/282/quality/80/optimize,39,4599,"돈은 거짓말 안 해
얘네 하고 있을 때 맨날 Cap
걔넨 날 뒤에서 Stab
어쩌면 걘 내가 되고 싶어 해
동네 친구들 내가 부럽대
그 맘이 영원히 든다면 좋겠네
감사한 게 많아 Always
근데 그만큼의 무게를 내 어깨에
배부른 소리
Tv 나오면 괜찮아질 거라던 놈이
새로운 고민
'별거 아니지'란 말을 달고 살았더니
쓰라려 데인 상처가
날 치료할 수 있는 무언가
가끔은 내 사람이 나를 제일
아프게 하는 거 같더라 정말
I don't know
시간은 안 기다려줘
의미가 없어진 내 Choice
잔소리로 들리는 조언
Oh don't talk
시간 없어 We gotta go
익숙해질 때가 올 거고
그때면 I swallow the prob
달려야 해 아파도
더는 시간이 없어
여기저기 엉망이야
멀쩡한 곳이 없어
I hope to see you again
다시 봤음 좋겠네
너무 어둡고 추웠지
화려했었던 무대 뒤에는
Vroong Vroong Vroong
Skrr Skrr Skrr
Vroong Vroong Vroong
Skrr Skrr Skrr
I go like Vroong skrr on that b**ch
I put ma ice on and skii on that b**ch
살아왔지만 난 씹 양아치로 날
못 따라왔지 너희 손가락질
묻었어 내 하얀 신발에 피
내게 쏟아진 의심의 눈빛
날 못 보게 벽돌을 쌓아 높이
난 숨어서 먹었어 썩은 음식
난 달려야 했어 누구보다 빨리
학교를 째고 열세 살에 독립
또래 애들과 너무 다른 고민
쟨 내고 있더라고 배부른 소리
어울리지 못해서 Got myself trapped in
길모퉁이에 서서 Was trappin
하루 종일 서있어 허수아비처럼
기분은 날아 마치 나비처럼
왜냐면 벌었지 돈
죽을뻔했지만 I had to do it
멈추지 않았어 겨눠도 총
여기까지 왔어 이 자리에
걔넨 뭐하고 있을지 궁금해
I was kept runnin like savage and boomin
거리에 서있던 애가 지금 무대
위에 서서 부르고 있잖아 이 노랠
달려야 해 아파도
더는 시간이 없어
여기저기 엉망이야
멀쩡한 곳이 없어
I hope to see you again
다시 봤음 좋겠네
너무 어둡고 추웠지
화려했었던 무대 뒤에는
Vroong Vroong Vroong
Skrr Skrr Skrr
Vroong Vroong Vroong
Skrr Skrr Skrr",458920936 447805092
32399834,친구,방탄소년단,랩/힙합,MAP OF THE SOUL : 7,Pdogg,Supreme Boi,20200221,https://cdnimg.melon.co.kr/cm2/album/images/103/77/346/10377346_20200221153622_500.jpg?83be62273cc86af9dea0468302203f11/melon/resize/282/quality/80/optimize,"2,757",185472,,411111859 403600774
33115804,"Achoo (Feat. pH-1, HAON) (Prod. GroovyRoom)",미란이 (MIRANI),랩/힙합,쇼미더머니 9 Episode 3,미란이 (MIRANI),pH-1,20201205,https://cdnimg.melon.co.kr/cm2/album/images/105/29/161/10529161_20201204130014_500.jpg?8ded96c28eec08239539fdaaf833f23d/melon/resize/282/quality/80/optimize,"1,036",68331,"바뀔 시간이 됐어 We go up with party 
벌어 Cash fame 이젠 이뤄 내 자리 
My way 봐 허덕이다 하늘까지 
얼어 붙은 삶을 바꿔 
더이상 더이상 떨지 않지 
I got the win
나를 더 믿어
하늘에 빌어
안보여 뒤
부셔 백미러 Imma hop out the beamer
사계절 Winter on my body
Achoo
Winter on my body 
Achoo
난 더 보여줘야 돼 Ballin’
누비지 날 버린 이 거리를
빌어 먹을 내 처지 
전부 다 해치워 버리고 All in 
의심 없이 달려 왔지 
같은 거리 동네 출신 
이뤄낼 차례가 됐어 직진 
떠 올라 난 매일이 나를 무시 하던 
애들을 다 제끼고 I’m ready
Or die 목걸이 
금방 걸구 온다 말했었잖아 
쉬어 엄만 곧 내 노래가 
들려올 테니까 걱정하지마 
에이 에이 이제는 지켜만 봐 
예예예 나는 될 수 밖에 없어 
난 기억해 How we live 
멈추지 않아 절대 될 때까지 
Cuz 난 기억해 How we live 
멈추지 않아 절대 될때까지 
바뀔 시간이 됐어 We go up with party 
벌어 Cash fame 이젠 이뤄 내 자리 
My way 봐 허덕이다 하늘까지 
얼어 붙은 삶을 바꿔 
더이상 더이상 떨지 않지 
I got the win
나를 더 믿어
하늘에 빌어
안보여 뒤
부셔 백미러 
Imma hop out the beamer
사계절 Winter on my body
Achoo
Winter on my body 
Achoo
난 계속 
달렸어 Put on my city 
기억도 못 할 만큼 많아 할 일이
I did it 
I did it 
앞길을 막으려는
너의 그 기분 I get it 
I get it
내가 변했다는 네 말은 
너 말고 안 믿어
소년의 말썽은 내가 참기로
I’m taking the H1GH road
기대도 안돼 네가 하는 반성
I got the win
Don’t forget the sweat the blood
Don’t forget the tears
잊혀지질 않아 
우리 엄마의 눈물이
그래서 더 빨리
벌어 더 많이 
Achoo
바뀔 시간이 됐어 
We go up with party 
벌어 Cash fame 이젠 이뤄 내 자리 
My way 봐 허덕이다 하늘까지 
얼어 붙은 삶을 바꿔 
더이상 더이상 떨지 않지 
I got the win
나를 더 믿어
하늘에 빌어
안보여 뒤
부셔 백미러 
Imma hop out the beamer
사계절 Winter on my body
Achoo
Winter on my body 
Achoo
이젠 모두 내게 맞춰 비위
기분이 안 좋은 게 
용납이 안 되는 위치
빌려 쓴 미소는 
나에게 질려버렸다는 듯이
이따금씩 이자를 묻지 I’mma pay 4 it
숫자 세 개 마다 붙어있는 쉼표
아디다스가 보낸 신발을 신고
밤마다 부스는 진동 이건 진통
울 엄마도 모르는 그대가 어떻게 이모
언제나 그랬듯이 
Time to get the papers
아버지의 차는 독일로 국적이 바뀌고
어린이에게도 권장되는 Rapper 
Mr Right direction
더는 아닐 수도
돈이 아니었지 내 목표
본의 아니게 보폭을 넓혀
종환이는 Morpheus
Neo가 아닌 CEO가 될지도
Tape RED Tape BLUE
So what you gon do 
Do it do it
무위도식
뻥이야 쟤네 벌이 
2020 Did me dirty
기원 COVID-19의 종식
Yessirski 높은 출신
우디 우기 그루비 
치원이형이 내 Broski
We miss 민식
DJ SMMT
TRADE L Naughty
Golden $hway
바뀔 시간이 됐어 
We go up with party 
벌어 Cash fame 이젠 이뤄 내 자리 
My way 봐 허덕이다 하늘까지 
얼어 붙은 삶을 바꿔 
더이상 더이상 떨지 않지 
I got the win
나를 더 믿어
하늘에 빌어
안보여 뒤
부셔 백미러 
Imma hop out the beamer
사계절 Winter on my body
Achoo
Winter on my body 
Achoo",458920936 447805092
34286948,Rain,Halsoon,랩/힙합 인디음악,Rain,Halsoon,ELLEBIZKIT,20211118,https://cdnimg.melon.co.kr/cm2/album/images/107/81/856/10781856_20211117172653_500.jpg?e641184c90ccc8e5e2045f6c682f852b/melon/resize/282/quality/80/optimize,29,16516,"네 하루에 비가 오면
잠겨있는 너를 꺼내줄게
근데 내가 잠길 때면
내 가시에 네가 베여
괜히 괜찮았던 네 기분을
내가 망칠까 무서워
내 하루에 비가와도
잠겨있는 날 안 꺼내도 돼
그냥 모른척 지나가 원래
이상하잖아 난
양심없이 네 손을 잡으려하면 놔
Yeah I’m waiting
for the God’s hand
넌 지나쳐도 돼
그저 빠르게 건져 올려지길
매일 기도해
어젠 왜 그랬어 물으면 사과할게
괜히 냈던 거야 심술
내 일이 잘 안풀려서
그러고 보니 요즘 원인 죄다 나야
우리의 fight
근데 넌 굳이 사랑주고 위로해
대체 왜야 I don’t know why
아마 난 hurt you
넌 많이 울었겠지 오늘도
근데 난 love you
난 이기적이라서 너를 또
네 하루에 비가 오면
잠겨있는 너를 꺼내줄게
근데 내가 잠길 때면
내 가시에 네가 베여
괜히 괜찮았던 네 기분을
내가 망칠까 무서워
내 하루에 비가와도
잠겨있는 날 안 꺼내도 돼
그냥 모른척 지나가
원래 이상하잖아 난
양심없이 네 손을 잡으려하면 놔
Yeah I was buried yeah
이제 생긴 벌이
너 덕에 중독되지 않고 버틴 커피
못 들은 척했던 너의 잔소리가
결국 날 살렸구나
바닥 구르던 나도 너를 만나
꽤 잘 살았구나
바닥을 굴러도 너는 늘 옆이고
밤에는 울어도 노랜 늘 불렀어
바닥 냄새가 뱄고
배터리는 바닥 쳤어도
자기 무서웠던
날 재워준건 너
내 옆에 있어준 건 너
그러니 네 하루에 비가 와도
Don’t worry I’ll be strong then
네 하루에 비가 오면
잠겨있는 너를 꺼내줄게
근데 내가 잠길 때면
내 가시에 네가 베여
괜히 괜찮았던 네 기분을
내가 망칠까 무서워
내 하루에 비가와도
잠겨있는 날 안 꺼내도 돼
그냥 모른척 지나가
원래 이상하잖아 난
양심없이 네 손을 잡으려하면 놔",405674502 491709976
33170811,Understand (Feat. GIST),MELOH,랩/힙합,MELOH,MELOH,Gist,20210102,https://cdnimg.melon.co.kr/cm2/album/images/105/41/062/10541062_20201231011056_500.jpg?4475498c89173424218158640feff5f2/melon/resize/282/quality/80/optimize,109,25786,"대체 뭔 말이 많아
너가 내 속을 알아
그냥 싫다면 떠나
넌 내 시간을 뺏어
필요 없다고 버려
그런 사람이라서
I hope you understand what I’m saying
I hope you understand what I’m saying
I hope you understand what I’m saying
I hope you understand what I’m saying
너 왜 자꾸 화내는 건데
I did nothing to you 그건 서운해
그래 맘은 문을 닫았네
시간에 무뎌지면 좋겠네
I’m just doing what I gotta do
몰라서 물어 더우니까 화내지 말고
내가 널 왜 믿어 뭘 보고 안 봐도 뻔해
Look at this picky eater
발 담그고 도망
갈 거 알고 있으니 그냥 빨리 물러가
온도는 내려가지 않아
너도 내 속 모르면서
이해 바라고 있잖아
그러니 날 미워하지 마
나도 니 속 모르면서
벌써 판단하고 있잖아
대체 뭔 말이 많아
너가 내 속을 알아
그냥 싫다면 떠나
넌 내 시간을 뺏어
필요 없다고 버려
그런 사람이라서
I hope you understand what I’m saying
I hope you understand what I’m saying
I hope you understand what I’m saying
I hope you understand what I’m saying
대체 뭔 말이 많아
이해해 주길 바라지마
내가 여태껏 해준 건
어디로 갔나
너를 말할 때 도망만 갔네
사랑은 누구 죄 똑같은 무게
근데 너 비교만 해
그러고는 할말 안 해
그러니 안 아파 내 마음이
널 믿을 수 있는 껀덕지 하나라도
주길 바랬어
같이 있던 곳이 담긴 앨범은
이 추운 날씨에 나처럼 혼자 있어
대체 뭔 말이 많아
너가 내 속을 알아
그냥 싫다면 떠나
넌 내 시간을 뺏어
필요 없다고 버려
그런 사람이라서
I hope you understand what I’m saying
I hope you understand what I’m saying
I hope you understand what I’m saying
I hope you understand what I’m saying",447805092 431918483
1851232,죽도록 사랑해 (Feat. 박정현),MC몽,랩/힙합,Show's Just Begun,MC몽,김희원,20080417,https://cdnimg.melon.co.kr/cm/album/images/003/76/194/376194_500.jpg/melon/resize/282/quality/80/optimize,167,22886,"죽도록 그대를 죽도록
죽도록 그대를 죽도록
죽도록 그대를 죽도록
죽도록 죽도록
죽도록 그대를 죽도록
죽도록 그대를 죽도록
죽도록 죽도록
죽도록 그대를 죽도록
그댈 볼수록 행복해 웃어줘
make me smile baby
Don't let me cry
사랑에 빠진 내 눈을 봐
눈이 아닌 가슴이 말을 하잖아
그댈 보며 웃잖아
사랑에 뭐가 필요해
또 뭘 바라면 바랄수록 아플 걸
till the end i'll be you'r man
니가 원하던 나야 yes i am
외로움에 가끔 미칠 때
우리 배가 가라앉고 있을 때
너는 내게 유일한 구명조끼
나를 비춰줘 오 나의 불빛
bring bring bring it together
기억해 빛나는 사랑을 주겠던
bring bring bring it together
그대를 죽도록 사랑해 주겠던
내 심장에 불을 붙여줘 
뜨거운 불에 또 바람을 불어줘
수백 번 고백해 내 위대한 사랑아
let's keep it hot i gotta keep 
it hot
널 볼수록 행복해 웃어줘
make me smile baby
Don't let me cry
사랑에 빠진 내 눈을 봐
눈이 아닌 가슴이 말을 하잖아
그댈 보며 웃잖아
가만히 있어도 시간은 흐르고
이 시간이 흐르면서 
죽음에 맞대고
평생을 사랑이란 
두 글자만 쓰다가
심장은 너무 닳아 사랑을 못 느껴
내 사랑은 푸른데 지구는 썩어가
영원의 눈으로 사랑을 바라봐
일차원적인 인간들의 세상 
사랑을 몰라
그게 우리네 자화상
평생을 남의 일이나 거들다
일이란 족쇄에 온몸은 멍들다
냉정한 가슴은 
사람들 외면에 썩어가 찢겨가 
내 주위 사람들까지 떠나가
마음이 가난한 자들은 사랑이란
머나먼 나라의 신기루
마음이 가난한 자들은 사랑이란
머나먼 나라의 신기루
그댈 볼수록 행복해 웃어줘
make me smile baby
Don't let me cry
사랑에 빠진 내 눈을 봐
눈이 아닌 가슴이 말을 하잖아
그댈 보며 웃잖아
널 볼수록 행복해 웃어줘
make me smile baby
Don't let me cry
사랑에 빠진 내 눈을 봐
눈이 아닌 가슴이 말을 하잖아
그댈 보며 웃잖아
난 웃잖아
넌 영원한 슈퍼스타 꽉 안아줘
hold me tight
부족한 나 땜에 날개가 꺾인
하늘에서 내려온 나의 천사
넌 영원한 슈퍼스타
내 사랑은 언제나 불타
거친 비바람 먹구름에 가려도
이 세상에 그대가 제일 빛나
넌 영원한 슈퍼스타 꽉 안아줘
hold me tight
부족한 나 땜에 날개가 꺾인
하늘에서 내려온 나의 천사
넌 영원한 나의 천사
넌 영원한 나의 천사
넌 영원한 나의 천사
넌 영원한 나의 천사",
1675592,말하자면,김성재,댄스 랩/힙합,김성재,이현도,이현도,19951111,https://cdnimg.melon.co.kr/cm/album/images/003/54/447/354447_500.jpg/melon/resize/282/quality/80/optimize,142,18503,"말 하자면
너를 사랑하고 있다는 말이야
하지만 나는 말할 수
없단 얘기야
하루가 또 지나도
난 항상 제자리에
너의 뒤에선 항상 너를 쳐다봐
너의 앞에선 항상 땅을 쳐다봐
넌 알지 못했니
어색하게 애써 외면을 했던 걸
우리 우연히 스쳐 지날때마다
서로 반갑게 지나쳐 갈때마다
넌 알지 못했니
너무나도 자주였던 걸 말이야
그 모든 순간들은 결코
우연들이 아니었어
사랑의 크기 만큼이나
두려워 하는
나의 바보같은 모습
말 하자면
너를 사랑하고 있다는 말이야
하지만 나는 말할 수
없단 얘기야
하루가 또 지나도
난 항상 제자리에
우리 우연히 스쳐 지날때마다
서로 반갑게 지나쳐 갈때마다
넌 알지 못했니
너무나도 자주였던 걸 말이야
그 모든 순간들은 결코
우연들이 아니었어
사랑의 크기 만큼이나
두려워 하는
나의 바보같은 모습
말 하자면
너를 사랑하고 있다는 말이야
하지만 나는 말할 수
없단 얘기야
하루가 또 지나도
난 항상 제자리에
말 하자면
너를 사랑하고 있다는 말이야
하지만 나는 말할 수
없단 얘기야
하루가 또 지나도
난 항상 제자리에",406125585 407307299
